{
  "schemaVersion": 1,
  "profileId": "react-vite",
  "priority": "P0",
  "topology": "single-project",
  "applications": [
    {"id": "web", "type": "frontend", "root": ".", "language": "typescript", "runtime": {"name": "node", "version": "22.23.1"}, "framework": {"name": "react-vite", "version": "19.1.0"}, "packageManager": {"name": "npm", "version": "10.9.8"}}
  ],
  "database": {"product": "none", "version": null, "role": "none", "migrationPairs": [], "restoreEvidenceRef": null},
  "artifacts": [
    {"path": "package.json", "content": "{\"name\":\"web\",\"private\":true,\"packageManager\":\"npm@10.9.8\"}\n"},
    {"path": "package-lock.json", "content": "{\"name\":\"web\",\"lockfileVersion\":3}\n"},
    {"path": "src/main.tsx", "content": "export const app = \"react-vite\";\n"}
  ],
  "execution": {"dependencyInstall": "NOT_RUN", "databaseMigration": "NOT_RUN", "providerWrite": "NOT_RUN", "productionDeploy": "NOT_RUN"}
}
